{
  "run_id": "matrix-local-check-dashboard-supply-chain-r03",
  "created_at": "2026-04-15T14:43:22+00:00",
  "task_id": "dashboard-supply-chain",
  "model": "gpt-5.4",
  "reasoning_effort": "medium",
  "style_module": "styles/glass-product-ui.md",
  "layout_module": "layouts/dashboard-density.md",
  "output_mapping": {
    "A": "baseline",
    "B": "grit"
  },
  "notes": "Batch run matrix-local-check, repeat 3"
}
