{
  "run_id": "matrix-local-check-landing-page-b2b-security-r03",
  "created_at": "2026-04-15T14:45:05+00:00",
  "task_id": "landing-page-b2b-security",
  "model": "gpt-5.4",
  "reasoning_effort": "medium",
  "style_module": "styles/modern-corporate-landing.md",
  "layout_module": "layouts/hero-composition.md",
  "output_mapping": {
    "A": "baseline",
    "B": "grit"
  },
  "notes": "Batch run matrix-local-check, repeat 3"
}
