{
  "run_id": "matrix-local-check-onboarding-form-hr-r03",
  "created_at": "2026-04-15T14:46:42+00:00",
  "task_id": "onboarding-form-hr",
  "model": "gpt-5.4",
  "reasoning_effort": "medium",
  "style_module": "styles/swiss-editorial.md",
  "layout_module": "layouts/form-clarity.md",
  "output_mapping": {
    "A": "baseline",
    "B": "grit"
  },
  "notes": "Batch run matrix-local-check, repeat 3"
}
