{
  "run_id": "matrix-local-check-settings-page-devtools-r03",
  "created_at": "2026-04-15T14:49:57+00:00",
  "task_id": "settings-page-devtools",
  "model": "gpt-5.4",
  "reasoning_effort": "medium",
  "style_module": "styles/glass-product-ui.md",
  "layout_module": "layouts/form-clarity.md",
  "output_mapping": {
    "A": "baseline",
    "B": "grit"
  },
  "notes": "Batch run matrix-local-check, repeat 3"
}
