{
  "run_id": "manual-mode-check",
  "created_at": "2026-04-15T14:23:54+00:00",
  "task_id": "settings-page-devtools",
  "model": "gpt-5.4",
  "reasoning_effort": "medium",
  "style_module": "styles/swiss-editorial.md",
  "layout_module": "layouts/form-clarity.md",
  "output_mapping": {
    "A": "baseline",
    "B": "grit"
  },
  "notes": ""
}
