{
  "run_id": "matrix-local-check-pricing-page-fintech-r01",
  "created_at": "2026-04-15T14:47:14+00:00",
  "task_id": "pricing-page-fintech",
  "model": "gpt-5.4",
  "reasoning_effort": "medium",
  "style_module": "styles/swiss-editorial.md",
  "layout_module": "layouts/grid-rhythm.md",
  "output_mapping": {
    "A": "baseline",
    "B": "grit"
  },
  "notes": "Batch run matrix-local-check, repeat 1"
}
