{
  "run_id": "provider-smoke-check",
  "created_at": "2026-04-15T13:59:13+00:00",
  "task_id": "pricing-page-fintech",
  "model": "gpt-5.4",
  "reasoning_effort": "medium",
  "style_module": "styles/swiss-editorial.md",
  "layout_module": "layouts/grid-rhythm.md",
  "output_mapping": {
    "A": "baseline",
    "B": "grit"
  },
  "notes": ""
}
